{
  "schema_version": "1.0",
  "catalog_id": "motiflux-motion-themes",
  "source_policy": "Public systems are principle analogues only; never claim a private vendor recipe or copied asset.",
  "themes": [
    {
      "id": "system-spatial",
      "name": "System-spatial",
      "aliases": ["system", "product", "saas", "dashboard", "enterprise", "interface", "structured", "clear", "technology", "education", "learning", "teaching", "course", "knowledge", "教育", "学习", "课程", "教学", "知识"],
      "trajectory_id": "knowledge-graph-lock",
      "trajectory_summary": "Place semantic nodes, connect their relationships, then lock the supplied mark component by component.",
      "public_analogue": "Material, Fluent, Atlassian, and Carbon-style motion principles",
      "design_intent": "Communicate state change, hierarchy, and spatial continuity through semantic movement.",
      "algorithm_stack": ["scene-graph dependency ordering", "shared spatial-anchor resolution", "monotonic cubic interpolation", "container-aware bounds", "reduced-motion substitution"],
      "implementation": ["move actors from semantic source locations", "preserve parent-child spatial relationships", "derive timing from distance and hierarchy"],
      "controls": ["hierarchy_weight", "spatial_distance", "stagger_window", "reduced_motion"],
      "exclusions": ["decorative particles", "unexplained overshoot", "random offsets", "simultaneous global motion"],
      "qa_focus": ["spatial continuity", "no layout shift", "focus order", "bounds"],
      "runtime": {"tempo": 1.0, "settle_damping": 0.82, "secondary_effect": "grid"}
    },
    {
      "id": "premium-quiet",
      "name": "Premium-quiet",
      "aliases": ["premium", "luxury", "fashion", "beauty", "editorial", "quiet", "elegant", "minimal"],
      "trajectory_id": "contour-etch",
      "trajectory_summary": "Trace the mark's measured outer contour first, then let the solid identity resolve with optical restraint.",
      "public_analogue": "Restrained editorial motion and Apple-style purpose, hierarchy, and user-control principles",
      "design_intent": "Create perceived value through restraint, material presence, optical alignment, and deliberate timing.",
      "algorithm_stack": ["low-amplitude transform field", "opacity-and-mask sequencing", "slow monotonic interpolation", "optical-alignment correction", "low-frequency highlight pass"],
      "implementation": ["reveal the highest-value contour first", "use small translation and scale ranges", "reserve contrast changes for the final identity moment"],
      "controls": ["amplitude", "pause_ratio", "contrast_reveal", "optical_offset"],
      "exclusions": ["bounce", "noisy particles", "fast per-letter cascades", "excessive blur"],
      "qa_focus": ["contour integrity", "optical centering", "frame pacing", "typography"],
      "runtime": {"tempo": 0.72, "settle_damping": 0.9, "secondary_effect": "quiet"}
    },
    {
      "id": "developer-open",
      "name": "Developer-open",
      "aliases": ["developer", "open source", "opensource", "api", "cli", "code", "tooling", "technical", "precise"],
      "trajectory_id": "token-commit",
      "trajectory_summary": "Commit deterministic identity tokens in an inspectable sequence, one source component at a time.",
      "public_analogue": "GitHub Primer motion principles and inspectable interface systems",
      "design_intent": "Make transformation legible to technical users through explicit phases and reproducible state.",
      "algorithm_stack": ["deterministic state machine", "tokenized property channels", "typed event timeline", "semantic actor metadata", "reproducible seek controls"],
      "implementation": ["expose named phases and actor IDs", "show construction through explicit dependencies", "prefer exact state transitions"],
      "controls": ["phase_step", "event_log", "seek", "seed", "reduced_motion"],
      "exclusions": ["opaque randomness", "hidden external services", "unreplayable timing"],
      "qa_focus": ["determinism", "event order", "inspectability", "keyboard operation"],
      "runtime": {"tempo": 1.0, "settle_damping": 0.84, "secondary_effect": "scan"}
    },
    {
      "id": "ai-field",
      "name": "AI-field",
      "aliases": ["ai", "artificial intelligence", "machine learning", "ml", "neural", "data", "model", "generative", "future", "intelligent"],
      "trajectory_id": "signal-convergence",
      "trajectory_summary": "Move deterministic external signals into their measured Logo pixels until the mark assembles from the field.",
      "public_analogue": "Public AI-product motion patterns using progressive disclosure, signal flow, and responsive feedback",
      "design_intent": "Suggest intelligence through organized transformation rather than science-fiction decoration.",
      "algorithm_stack": ["constraint-to-signal mapping", "seeded vector-field guidance", "graph-flow convergence", "progressive disclosure", "confidence-bounded morphing"],
      "implementation": ["start from a stable semantic mark", "guide abstract signals into real geometry", "use deterministic seeded particles only as a secondary layer", "end with a quiet canonical state"],
      "controls": ["field_density", "convergence_rate", "signal_amplitude", "seed", "accessibility_mode"],
      "exclusions": ["random neural-network imagery", "fake data claims", "uncontrolled noise", "particle-first identity"],
      "qa_focus": ["determinism", "semantic landing", "performance", "reduced motion", "misleading-data avoidance"],
      "runtime": {"tempo": 0.92, "settle_damping": 0.86, "secondary_effect": "field"}
    },
    {
      "id": "fintech-trust",
      "name": "Fintech-trust",
      "aliases": ["fintech", "banking", "bank", "payments", "payment", "trust", "finance", "institutional", "reliable", "secure finance"],
      "trajectory_id": "progress-confirm",
      "trajectory_summary": "Use a bounded progress state to reveal the mark from its center, then settle into an unambiguous confirmation.",
      "public_analogue": "Predictable system feedback, hierarchy, and calm state-transition principles",
      "design_intent": "Communicate reliability, controlled movement, and successful resolution.",
      "algorithm_stack": ["monotonic progress", "guarded state transitions", "bounded confirmation spring", "high-contrast completion cue", "failure-safe cancellation"],
      "implementation": ["use explicit start, processing, success, and idle states", "keep security status unambiguous", "make motion reversible or cancellable"],
      "controls": ["progress_mode", "confirmation_amplitude", "cancellation", "reduced_motion"],
      "exclusions": ["playful bounce during security states", "sudden camera motion", "ambiguous looping"],
      "qa_focus": ["state correctness", "cancellation", "contrast", "announcement timing", "no false success"],
      "runtime": {"tempo": 0.86, "settle_damping": 0.88, "secondary_effect": "ring"}
    },
    {
      "id": "security-shield",
      "name": "Security-shield",
      "aliases": ["security", "privacy", "identity", "authentication", "auth", "defense", "shield", "compliance", "protection"],
      "trajectory_id": "boundary-unlock",
      "trajectory_summary": "Establish the measured Logo boundary first, verify the interior, and unlock the wordmark last.",
      "public_analogue": "Accessible system motion with explicit focus, status feedback, and user control",
      "design_intent": "Convey boundary, verification, and controlled access.",
      "algorithm_stack": ["boundary-first reveal", "occlusion-and-aperture logic", "finite-state verification sequence", "restrained lock transition", "interruptible animation"],
      "implementation": ["reveal perimeter before interior detail", "use one explicit verification transition", "freeze safely when interrupted or hidden"],
      "controls": ["verification_state", "interrupt", "focus_target", "reduced_motion"],
      "exclusions": ["glitch as default identity", "flickering warnings", "hidden state changes"],
      "qa_focus": ["semantic state", "interruption", "focus", "contrast", "temporal clarity"],
      "runtime": {"tempo": 0.8, "settle_damping": 0.9, "secondary_effect": "shield"}
    },
    {
      "id": "commerce-energy",
      "name": "Commerce-energy",
      "aliases": ["commerce", "retail", "shopping", "marketplace", "consumer", "sale", "conversion", "friendly"],
      "trajectory_id": "burst-assembly",
      "trajectory_summary": "Compress identity components at a shared origin, release them outward, and settle quickly into the lockup.",
      "public_analogue": "Public commerce-system interaction feedback and clear-affordance principles",
      "design_intent": "Create approachability and action without making the brand feel unstable.",
      "algorithm_stack": ["short interaction transitions", "spring-like confirmation", "badge-and-accent choreography", "responsive hit-area anchoring", "action-completion state machine"],
      "implementation": ["make the mark react to action context", "use a small anticipatory cue", "return rapidly to stable idle"],
      "controls": ["interaction_speed", "confirmation_scale", "touch_safe_range", "reduced_motion"],
      "exclusions": ["constant motion", "bait-like pulses", "delayed affordance feedback"],
      "qa_focus": ["input latency", "hit-area stability", "repeat action", "focus", "touch behavior"],
      "runtime": {"tempo": 1.2, "settle_damping": 0.72, "secondary_effect": "burst"}
    },
    {
      "id": "automotive-precision",
      "name": "Automotive-precision",
      "aliases": ["automotive", "mobility", "transport", "engineering", "performance", "industrial", "mechanical"],
      "trajectory_id": "kinematic-lock",
      "trajectory_summary": "Carry each supplied component along one directional velocity path and lock it with a controlled scan.",
      "public_analogue": "Engineering-oriented physical continuity, hierarchy, and controlled acceleration",